{
  "schemaVersion": "pair-evidence/1.0",
  "dictionaryVersion": "1.0.0",
  "pipelineVersion": "1.0.0",
  "generatedAt": "2026-09-23T20:43:26.873874+00:00",
  "useCase": "Public contextual baseline; reviewer must assess use-case relevance",
  "geography": {
    "geoid": "21111",
    "name": "Jefferson County",
    "type": "county",
    "boundaryVintage": "ACS 2024",
    "boundaryUrl": "https://tigerweb.geo.census.gov/arcgis/rest/services/TIGERweb/tigerWMS_ACS2024/MapServer/82/query?where=GEOID%3D%2721111%27&outFields=GEOID%2CNAME%2CAREALAND%2CAREAWATER&outSR=4326&f=geojson",
    "geometryHash": "2de8d3de9530bb0ccba12ca760a8ac62f5819398f6e34115ef868e2caa79e9f5",
    "geometry": {
      "type": "Polygon",
      "coordinates": [
        [
          [
            -85.70478299992806,
            38.285559999666596
          ],
          [
            -85.70528099987042,
            38.28530300031823
          ],
          [
            -85.70581999982068,
            38.285025999979766
          ],
          [
            -85.70685699971331,
            38.284459999796915
          ],
          [
            -85.70788799975816,
            38.28390000011394
          ],
          [
            -85.71032899996453,
            38.28267999972291
          ],
          [
            -85.71165899976012,
            38.28203500013183
          ],
          [
            -85.71304200015747,
            38.28143799979508
          ],
          [
            -85.71425599960209,
            38.28087800006981
          ],
          [
            -85.71479600027558,
            38.28062799983037
          ],
          [
            -85.71610599997969,
            38.28002399968214
          ],
          [
            -85.71694399968067,
            38.27963800021534
          ],
          [
            -85.71837300010878,
            38.27889200011413
          ],
          [
            -85.7200910002419,
            38.27812700019734
          ],
          [
            -85.72084600010221,
            38.277777999861556
          ],
          [
            -85.7211749999902,
            38.27750299965591
          ],
          [
            -85.72130700023467,
            38.277448000053965
          ],
          [
            -85.72276199970372,
            38.276959000196754
          ],
          [
            -85.7234150003551,
            38.27667899981971
          ],
          [
            -85.72377000018236,
            38.27654599979124
          ],
          [
            -85.72400500035899,
            38.276414000206174
          ],
          [
            -85.7242599997288,
            38.2763179997802
          ],
          [
            -85.72465700028714,
            38.276122000014965
          ],
          [
            -85.72476400041727,
            38.27606300012594
          ],
          [
            -85.72489900013649,
            38.27590899991487
          ],
          [
            -85.7250139997642,
            38.27581600020163
          ],
          [
            -85.7257309999897,
            38.27552599970921
          ],
          [
            -85.72584300014269,
            38.27546400005671
          ],
          [
            -85.72804999999734,
            38.27442400011032
          ],
          [
            -85.72845500005329,
            38.27421099996594
          ],
          [
            -85.72909899958553,
            38.273930000259966
          ],
          [
            -85.72974100036626,
            38.27356699991102
          ],
          [
            -85.7299980002842,
            38.273452000232155
          ],
          [
            -85.73010200004128,
            38.27335800016925
          ],
          [
            -85.73010200004128,
            38.273231999879094
          ],
          [
            -85.73013600037648,
            38.27315499998591
          ],
          [
            -85.73033700021793,
            38.272979000024286
          ],
          [
            -85.73113899993392,
            38.272671000299205
          ],
          [
            -85.73136800026276,
            38.27256100008085
          ],
          [
            -85.73171200021936,
            38.272347000076195
          ],
          [
            -85.73220400031394,
            38.272100000206244
          ],
          [
            -85.73257099983674,
            38.2719549997371
          ],
          [
            -85.73320699987138,
            38.27170399975813
          ],
          [
            -85.73387800006611,
            38.271345999824014
          ],
          [
            -85.73471999996508,
            38.27091799978124
          ],
          [
            -85.7350460003783,
            38.270647999995845
          ],
          [
            -85.73545700028207,
            38.27050300015387
          ],
          [
            -85.73557299973469,
            38.270461999669436
          ],
          [
            -85.73694799973612,
            38.269675000281474
          ],
          [
            -85.7375729999001,
            38.269322999990635
          ],
          [
            -85.73782499979518,
            38.26922499990264
          ],
          [
            -85.73799700022263,
            38.2690980001172
          ],
          [
            -85.73820399991186,
            38.269032000285364
          ],
          [
            -85.73831799971468,
            38.269018999905356
          ],
          [
            -85.73853600017287,
            38.268992999843654
          ],
          [
            -85.7387420000372,
            38.268932999719915
          ],
          [
            -85.73899999978006,
            38.26881699966936
          ],
          [
            -85.73957899991329,
            38.26850400017714
          ],
          [
            -85.74070100019473,
            38.26803900025722
          ],
          [
            -85.74159499997224,
            38.2676679999727
          ],
          [
            -85.74255200039724,
            38.267442999909264
          ],
          [
            -85.74347499958873,
            38.2672940002924
          ],
          [
            -85.74407999966122,
            38.267240000119145
          ],
          [
            -85.74467399986305,
            38.26720999969206
          ],
          [
            -85.74480100008468,
            38.26720399974622
          ],
          [
            -85.74496099991823,
            38.26719600028786
          ],
          [
            -85.74507700026919,
            38.267190000340825
          ],
          [
            -85.74653900030927,
            38.267170000278824
          ],
          [
            -85.74674000015071,
            38.26718900023211
          ],
          [
            -85.74746800024685,
            38.26721500023429
          ],
          [
            -85.74822999977988,
            38.267313000213235
          ],
          [
            -85.7483510001537,
            38.26733900017103
          ],
          [
            -85.74864599970647,
            38.26736600022593
          ],
          [
            -85.74952299976553,
            38.26758100020012
          ],
          [
            -85.7496459997892,
            38.267612999974524
          ],
          [
            -85.75067000016134,
            38.26782900002285
          ],
          [
            -85.7512020004389,
            38.267939999748776
          ],
          [
            -85.75147500025038,
            38.26799799979228
          ],
          [
            -85.75395300026668,
            38.26879000015391
          ],
          [
            -85.75442100007182,
            38.268996000095356
          ],
          [
            -85.75464200000476,
            38.26892300028225
          ],
          [
            -85.75509399991637,
            38.26904900029055
          ],
          [
            -85.75527800003938,
            38.26915399977784
          ],
          [
            -85.75541000028386,
            38.269423000102506
          ],
          [
            -85.7556589998059,
            38.269606000042316
          ],
          [
            -85.75591800027198,
            38.269750000191074
          ],
          [
            -85.7559769998232,
            38.269774999908684
          ],
          [
            -85.75633199965046,
            38.269885000115366
          ],
          [
            -85.7569049999359,
            38.27019800000354
          ],
          [
            -85.75710499995245,
            38.27033000030906
          ],
          [
            -85.75738000031205,
            38.27041300005776
          ],
          [
            -85.75779899971339,
            38.2705940002004
          ],
          [
            -85.7583140002725,
            38.27092899970685
          ],
          [
            -85.75865499985605,
            38.271101000185645
          ],
          [
            -85.75867599977245,
            38.27110999997398
          ],
          [
            -85.75901899990411,
            38.27122599988851
          ],
          [
            -85.75939200017304,
            38.27131400028377
          ],
          [
            -85.76049799966262,
            38.27173799992411
          ],
          [
            -85.76092199998514,
            38.27191400007235
          ],
          [
            -85.76126500011682,
            38.27211099995282
          ],
          [
            -85.76142199957735,
            38.27223199987579
          ],
          [
            -85.7614879996996,
            38.272266999833384
          ],
          [
            -85.76318699956612,
            38.27353299989616
          ],
          [
            -85.76335899999357,
            38.27372900030262
          ],
          [
            -85.76371200017098,
            38.27412900033979
          ],
          [
            -85.763740999585,
            38.27416100005013
          ],
          [